{"data":{"commit_oid":"09033b36ebcc0ef006cbb68bfb572089569974ba","limits":{"config":{"max_array_items":256,"max_declarations":4096,"max_depth":32,"max_key_bytes":256,"max_nodes":1024,"max_numeric_abs_exponent":128,"max_numeric_canonical_bytes":256,"max_numeric_coefficient_digits":64,"max_numeric_lexeme_bytes":128,"max_object_keys":1024,"max_scalars":512,"max_source_bytes":262144,"max_string_codepoints":16384},"git":{"max_object_bytes":8388608,"max_objects":2048,"max_targets":32,"max_total_object_bytes":33554432,"max_tree_entries":32768},"public":{"max_bundle_bytes":1048576,"max_config_document_bytes":2097152,"max_handoff_bytes":131072,"max_inline_normalized_bytes":16384,"max_intent_bytes":1048576,"max_observation_bytes":2097152,"max_output_peak_bytes":134217728,"max_request_bytes":65536}},"object_format":"sha1","paper_id":"arxiv:2401.01234","profile_sha256":"0000000000000000000000000000000000000000000000000000000000000000","repository":"synthetic-owner/synthetic-repo","require_repository_assertion":false,"source_association":null,"targets":[{"allow_executable_source":false,"path":"config.json","roles":["configuration"]}]},"id":"ce1:code-proof-request:a28210269721e31bf2cfe07c00fb7b0dc8f15224d8c83a01424d7715839ca1f4","kind":"code-proof-request","schema":"video-paper-wiki.code-proof-request.v1"}
